{
  "schema_version": "2.1.0",
  "document_type": "test_summary",
  "task_id": "hwpx-core-benchmark-003-evidence-integrity",
  "tested_implementation_commit_sha": "e182f2e0259ff2ac451c5a8a621516304015ac82",
  "independent_ci_verification": {
    "required_for_completion": false,
    "status": "not_required",
    "limitation": "local offline rerun evidence only",
    "evidence_path": null,
    "evidence_sha256": null
  },
  "totals": {
    "passed": 226,
    "failed": 0,
    "skipped": 0
  },
  "required_runs": [
    {
      "run_id": "gate-a-task003-six-node-v6",
      "required_for_completion": true,
      "executed": true,
      "exit_code": 0,
      "passed": true,
      "failed": 0,
      "stdout_path": "tests/logs/gate-a-task003-six-node-v6.stdout.log",
      "stderr_path": "tests/logs/gate-a-task003-six-node-v6.stderr.log"
    },
    {
      "run_id": "gate-b-current-full-hancom-v6",
      "required_for_completion": true,
      "executed": true,
      "exit_code": 0,
      "passed": true,
      "failed": 0,
      "stdout_path": "tests/logs/gate-b-current-full-hancom-v6.stdout.log",
      "stderr_path": "tests/logs/gate-b-current-full-hancom-v6.stderr.log"
    },
    {
      "run_id": "gate-c-ajv-meta-schema-v6",
      "required_for_completion": true,
      "executed": true,
      "exit_code": 0,
      "passed": true,
      "failed": 0,
      "stdout_path": "tests/logs/gate-c-ajv-meta-schema-v6.stdout.log",
      "stderr_path": "tests/logs/gate-c-ajv-meta-schema-v6.stderr.log"
    },
    {
      "run_id": "gate-d0-pre-output-sanity-v6",
      "required_for_completion": true,
      "executed": true,
      "exit_code": 0,
      "passed": true,
      "failed": 0,
      "stdout_path": "tests/logs/gate-d0-pre-output-sanity-v6.stdout.log",
      "stderr_path": "tests/logs/gate-d0-pre-output-sanity-v6.stderr.log"
    },
    {
      "run_id": "gate-d1-canonical-output-generation-v6",
      "required_for_completion": true,
      "executed": true,
      "exit_code": 0,
      "passed": true,
      "failed": 0,
      "stdout_path": "tests/gate-d1-canonical-output-generation-v6.result.txt",
      "stderr_path": "tests/logs/gate-d2-final-mapped-json-validation-v6.stderr.log"
    },
    {
      "run_id": "gate-d2-final-mapped-json-validation-v6",
      "required_for_completion": true,
      "executed": true,
      "exit_code": 0,
      "passed": true,
      "failed": 0,
      "stdout_path": "tests/logs/gate-d2-final-mapped-json-validation-v6.stdout.log",
      "stderr_path": "tests/logs/gate-d2-final-mapped-json-validation-v6.stderr.log"
    },
    {
      "run_id": "post-d2-native-scenario-gates-v6",
      "required_for_completion": true,
      "executed": true,
      "exit_code": 0,
      "passed": true,
      "failed": 0,
      "stdout_path": "tests/logs/post-d2-scenario-gates-v6.stdout.log",
      "stderr_path": "tests/logs/post-d2-scenario-gates-v6.stderr.log"
    }
  ],
  "optional_runs": [],
  "invalid_pass_count": 0,
  "schema_validation_failures": 0,
  "completion_gate_passed": true,
  "limitations": [
    "Native HWPX evidence generated by local Hancom COM; external-artifacts/task003-v6 is git ignored and requires explicit tracking strategy before commit."
  ]
}
